{"schema":"https://debz.dev/schema/apt-system-result-v2","version":2,"api_version":1,"operation":"list_installed","request_sha256":"1111111111111111111111111111111111111111111111111111111111111111","profile":{"path":"/profile.json","sha256":"2222222222222222222222222222222222222222222222222222222222222222","reference_evidence_sha256":"3333333333333333333333333333333333333333333333333333333333333333"},"outcome":"success","exit_status":0,"changed":false,"summary":"installed packages","items":[{"package":"alpha","version":"1","architecture":"amd64","detail":null}],"evidence":{"exact_lock":null,"transaction_result":null,"root_operation_completion":null,"active_operation_state":null},"diagnostics":[],"digest_sha256":"7d390e5d6ac475814fd9e291b1c368d113319cac53945a7e4cee6c7a8a071459"}
